{
  "schemaVersion": 1,
  "appId": "official.city-pulse",
  "intent": "Добавь отдельную карточку влажности после прогноза",
  "operations": [
    {
      "op": "addWidget",
      "widget": { "id": "humidity", "kind": "humidity-card", "title": "Влажность воздуха" },
      "after": "forecast"
    }
  ]
}
